51,Heroy et al. 2021,COVID-19 policy analysis: labour structure dictates lockdown mobility behaviour.,2021,Journal of the Royal Society Interface,To analyse the impact of lockdown policies on urban mobility in Colombia,Colombia,-,Original Research,Ecological study,General population,"n=15,347 users across 22 municipalities",Socioeconomic/Geographic,"Mapping individuals to spatial units, individual-level regression analyses,and aggregate analyses",-Socioeconomic status: 1 to 6,-Socioeconomic status,"1. The extent of the gender-based  policy enforcement/adherence is generally unclear across municipalities, especially in the informal labour sector..2. Most users across all municipalities reduced their daily distance travelled during lockdown. .3. Most municipalities had a mean lockdown trip frequency of 25–30%  This represents a reduction in mobility from baseline levels that were 20–45% higher, with the largest reduction in Bogotá.4. Smaller municipalities permitted fewer people out daily (Pearson’s ? = 0.43, p = 0.04).5. Larger cities that better enables residents to reduce mobility despite less severe mobility quotas. .6. COVID-19 growth is slower on a per capita basis in larger cities levels.7. Mobility reduction are significantly associated (p < 0.01) with municipality-level economic variables including GDP per capita and labour formality rate economic advantages of larger cities favour mobility reduction.",Needing for future policy measures to increase aid-based measures alongside or even in place of mobility restrictions.,"1. Larger, wealthier cities reduced mobility the most, even though they generally imposed less severe mobility quotas. .2. Smaller cities, with more informal employment, did not experience a comparable reduction..3. Urban residents are more influenced by their economic capacity to comply with rules than by the precise measures implemented locally..4. Mobility reduction is influenced by other factors such as degree of enforcement of the policy, the availability of economic aid to workers and firms, population density and the number of infections in the city..5. Residents of cities with larger caseloads early in the pandemic are likely to have been more willing to lock down.6. Less wealthy, often informal firms have less financial capacity to close operations..7. Workers particularly in smaller cities—often informally employed and rarely in teleworkable occupations—cannot work from home (...) and (...) continue working despite mobility restrictions.",UKRI’s Global Challenge Research Fund and MIT Connection Science research alliance,English,0,0,0,0,0,0,0,1,0,0,0,0,1,0,0,0,0,0,0,0,0,0,0,0,0,0,0,0,0,0,0,0,0,0,0,0,0,0,0,0,0,0,0,0,0,0,0,0,0,0,0,0,0,0,0,0,0,0,0,0,0,1,0,0,0,1,0,0,0,0,0,0,0,0,0,0,0,0,0,0,1,0,0,0,0,0,0,0,0,0,0,0,0,0,0,0,1,0,0,0,0,0,0,0,0,0,0,0,0,0,0,0,0,0,0,0,0,0,0,0,0,0,0,0,0,0,0,0,0,0,0,0,2,Ecological study,0,0
52,Bolaño-Ortiz et al. 2020,"Spread of SARS-CoV-2 through Latin America and the Caribbean region: A look from its economic conditions, climate and air pollution indicators.",2020,Environmental Research,"To design a strategy to tackle the current COVID-19 pandemic and prevent future epidemics similar to COVID-19, that generate health and socioeconomic problems for nations and the world",Colombia/Ecuador/Brazil/Peru/Chile/Argentina,"Bogotá (Colombia), Guayaquil (Ecuador), Manaus (Brazil), Lima (Perú), Santiago (Chile), São Paulo (Brazil) and Buenos Aires (Argentina).",Original Research,Ecological study,General population,"n=7,413 Bogotá (Colombia)  / n=2,654 Guayaquil (Ecuador) 2.654 / n=1,802 Manaus (Brazil)  / n=9,674 Limae (Perú) / n=12,176  Sao Paulo (Brazil) / n=6,257 Santiagoe (Chile) / n=3,063 Buenos Aires (Argentina)",Socioeconomic,"The Spearman rank correlation tests were used to examine the correlation between climate indicators and COVID-19 variables (daily cases and deaths), because the dataset had a non-normal distribution. This was verified previously by the Shapiro-Wilk normality test. Finally, the spread of COVID-19 is related to the economic characteristics observed in LAC.",-Gini index .-Human development index,-Socioeconomic status,"1. The cities analyzed have a high and very high Human Development Index. However, they have a large inequality gap as shown by the Gini index (Table 1). .2. Gini Index: Bogota (colombia)= 51.5, Guayaquil (Ecuador)=53.4, Manaus (Brazil)=53.2, Lima (Perú)=53.7, Sao Paulo (Brazil)=53.2, Santiago (Chile)=57.2, Buenos Aires (Argentina)=46.8.3. Human develop index: Bogota (colombia)= 0.792, Guayaquil (Ecuador)=0.863, Manaus (Brazil)=0.737, Lima (Perú)=0.90, Sao Paulo (Brazil)=0.843, Santiago (Chile)=0.916, Buenos Aires (Argentina)=0.925..4. Chile, Brazil and Perú have the highest Gini index values in LAC and this coincide with those with the highest number of infections (shown in Fig. 2). In addition, among.the cities analyzed, these three countries have the three cities with the highest infection rate by COVID-19 per 100,000 inhabitants.",It is not mentioned in this article,"1. These findings can be used by researchers and policymakers as a starting point for supporting further research and measures, in order to stop and prevent the spread of COVID-19 in the LAC region. .2. This study has explored the evolution of COVID-19 through LAC and provides interesting insights that should be further explored. .3. Future research should carry out a comprehensive study that considers epidemiological aspects, social distancing policies, socioeconomic issues, different air pollutants, and the different lockdown and mobility restriction measures implemented in each country.","Agencia de Promoción Científica (project PICT 2016 1115), FRM-UTN and CONICET in Argentina; GORE-FNDR-V Regi´on in Valparaíso and Programa de Asignación Rápida de Recursos para Proyectos de Investigación Sobre el Coronavirus (COVID-19) (project COVID0581-2020), ANID, Ministerio de Ciencia, Tecnología, Conocimiento e Innovaci´on, both in Chile; and Coordenaçao de Aperfeiçoamento de Pessoal de Nível Superior (CAPES) Finance Code 001 in Brazil",English,1,1,0,1,0,0,0,1,1,1,0,0,1,0,0,0,0,0,0,0,0,0,0,0,0,0,0,0,0,0,0,0,0,0,0,0,0,0,0,1,1,0,0,0,0,0,0,0,1,0,0,0,0,0,0,0,0,0,0,0,0,1,0,0,0,0,0,0,0,0,0,0,0,0,0,1,0,0,0,0,0,0,0,0,0,0,0,0,0,0,0,0,0,0,0,0,0,0,0,0,0,0,0,0,0,0,0,0,0,0,0,0,0,0,0,0,0,0,0,0,0,0,0,0,0,0,0,0,0,0,0,0,1,Ecological study,0,0
53,Bitencourt and Andrade 2021,Trabalhadoras da saúde face à pandemia: por uma análise sociológica do trabalho de cuidado,2021,,"a) to discuss the contributions by gender studies for analyzing care work by women, especially healthcare, in its dual dimensions, productive and reproductive, emphasizing the specificities of care as work..b) to analyze work conditions, illness, and death of female and male healthcare workers in the context of Covid-19 in Brazil.",Brazil,-,Essays/Reflection article,Narrative reflection,Female healthcare workers,NA,Gender/Labour,It does not directly measure inequalities (narrative synthesis),NA,-Occupation.-Gender/sex,"1. Female healthcare workers make their decisions in this moment of the pandemic concerning who will care for their children and family members in general, since daycare centers, preschools, and schools are closed to contain the spread of coronavirus, creating difficulties for reconciling productive and reproductive work..2 Female healthcare workers, unlike a major portion of the population, who are in social isolation or distancing due to coronavirus control, are leading the high-risk care, since the virus has intense and extensive global spread..3. Gender relations and women´s disadvantages in the labor market.",It is not mentioned in this article,"1. Government attention to healthcare work and professional societies, perceiving the adverse work conditions in confronting the pandemic..2. The sociological analysis of healthcare work allowed understanding that many women, as healthcare workers, are experiencing countless challenges",It does not specify,English,0,1,0,0,0,0,0,0,0,0,0,0,0,0,0,0,0,0,1,1,0,0,0,0,0,0,0,0,0,0,0,0,0,0,0,0,0,0,0,0,0,0,0,0,0,0,0,0,0,0,0,0,0,0,0,0,0,0,0,0,0,0,0,1,1,0,0,0,0,0,0,0,0,0,0,0,0,0,0,0,0,0,0,0,0,0,0,0,0,1,0,0,0,0,0,0,0,0,0,0,0,0,0,0,0,0,0,0,0,0,0,0,0,0,0,0,0,0,0,0,0,0,0,0,0,0,0,0,0,0,0,0,0,Narrative reflection,0,0
54,Cobre et al. 2020,"Risk factors associated with delay in diagnosis and mortality in patients with COVID-19 in the city of Rio de Janeiro, Brazil",2020,Ciência & Saúde Coletiva,"To investigate the risk factors associated of delay in the diagnosis and mortality of patients with COVID-19 in Rio de Janeiro, Brazil",Brazil,Rio de Janeiro,Original Research,Retrospective cohort study,Patients diagnosed with COVID-19,"n=3,656 (Data from the Painel Rio COVID-19 database13, maintained by the City Hall of Rio de Janeiro)",Socioeconomic/Gender,1. A descriptive statistical analysis using the median and interquartile range (IQR).2. Kaplan-Meier method was adopted to estimate the delay in diagnosis.,-Age group.-Gender: Male/Female /Not informed.-social development index (SDI): Low / High.-Evolution of the disease..-Time to diagnosis..-Mortality (‘dead / ‘alive’),"-Socioeconomic status.-Race/ethnicity/culture/language.-Gender/sex.-Personal characteristics associated with discrimination (e.g. age, disability)","1. Cox regression multivariate analyses revealed that males (HR = 0.846 [95% CI, 0.739-0.968]; p= 0.015), patients living in regions with a low SDI (HR = 0.721 [95% CI, 0.614-0.847]; p = 0.000), patients with active disease (HR = 1.960 [95% CI,1.574-2.440]; p = 0.000) had longer delays in diagnosis..2. Multivariate analysis of logistic regression showed that male patients had a higher odds of death from COVID-19 than female patients (OR = 0.150 [95% CI, 0.051-0.440]; p = 0.001)..3) The age groups that were statistically associated with death were: 70-79 years (OR = 1.495 [95% CI, 1.121-1.994]; p = 0.006), 80-89 years (OR = 3.146 [95% CI, 2.256-4.387]; p < 0.001), and 90-99 years (OR = 5.100 [95% CI, 2.024-12.852]; p = 0.001). .4) Patients from regions with a low SDI had increased odds for death from COVID-19 (OR= 1.833 [95% CI, 1.565-2.148]; p < 0.001). Delay to diagnosis greater than eight days was also a risk factor for death (OR = 3.537 [95% CI, 2.769-4.519]; p < 0.001).",It is not mentioned in this article,"1. Delays in diagnosis and risk factors for death from COVID-19 in Rio de Janeiro, Brazil were associated with male gender, age under 60 years, and patients living in regions with lower social development index, including favelas..2. Delay between the onset of symptoms until diagnosis greater than eight days may increase mortality rates..3. These results highlight the continuous challenges to contain, mitigate, and control the disease in environments with scarce resources, including the lack of mass testing. Further preventive measures are still needed, especially for vulnerable groups.",It does not specify,English,0,1,0,0,0,0,0,0,0,0,0,0,1,1,1,1,1,0,1,0,0,0,1,0,1,0,0,0,0,1,1,0,0,0,0,0,0,0,0,0,0,0,0,0,0,0,0,0,1,0,0,0,0,0,1,0,0,0,0,0,0,1,0,1,0,0,0,0,0,0,0,0,0,0,0,0,0,0,0,0,0,0,0,0,0,0,0,1,0,0,0,0,0,0,0,0,0,0,0,0,0,0,0,0,0,0,0,0,1,0,0,0,0,0,0,0,0,0,0,0,0,0,0,0,0,0,0,0,0,0,0,0,2,Retrospective cohort study,0,1
55,Hossain 2021,Unequal experience of COVID-induced remote schooling in four developing countries,2021,International Journal of Educational Development,"To assess possible disparities in access to remote education in four countries, including Peru",Peru,-,Original Research,Cross-sectional observational study (survey),People aged between 5 and 26 years old who were also reportedly active learning through educational institutions.,It is not clear,Socioeconomic/Geographic,Logistic regression model to estimate the association between different sociodemographic factors and remote schooling.,1. Education level of the household head: no education/ primary/ secondary/ higher/ adult or religious/other education.2. Gender: male/female.3. Geographic: Rural/Urban.4. Age: primary (5–11 year-olds) / secondary (12–18 year-olds) / higher education (19–26 year-olds) age learners/students,"-Place of residence.-Education.-Personal characteristics associated with discrimination (e.g. age, disability)",1. The urban coefficient appears significant only after controlling for all other covariates. Rural people may have limited access to facilities and public amenities that urban dwellers regularly enjoy. One may argue that greater remote schooling in urban areas could be triggered by being more affected by the pandemic than rural areas..2. Tertiary education age students are less likely to experience remote schooling compared to primary education age ones while the coefficient for the secondary education age group is not significant. Peru’s case suggests that younger students are more likely to experience remote schooling..3. Male students are less likely to experience remote schooling than female students. The non-significant gender differences possibly indicate the widespread effect of the pandemic irrespective of gender..,It is not mentioned in this article,"1. This suggests that socioeconomic disparities are the main determinants of who gets to access alternative schooling during the pandemic, which can affect female and male students similarly. .2. Not to suggest that gender disparity may not exist during the pandemic as this data is limited to merely showing who are likely to experience remote schooling. They do not know whether girls are learning similarly by accessing remote learning materials and whether other indirect factors may be affecting them..3. It gives a snapshot of disparity at the early stage of the pandemic which may gradually intensify. Distance teaching for deprived communities should be prioritised in the budget to account for any future crises.",It does not specify,English,0,0,0,0,0,0,0,0,0,1,0,1,0,0,0,0,0,1,0,0,0,0,1,0,1,0,0,0,0,1,1,0,0,0,0,0,0,1,1,0,0,0,0,0,0,0,0,0,0,0,0,0,0,0,0,0,0,0,0,0,0,1,0,0,0,1,0,0,0,0,0,0,0,0,0,0,0,0,0,0,1,0,0,0,0,0,0,0,0,0,0,0,0,0,0,0,0,0,0,0,0,0,0,0,0,0,0,0,0,0,0,0,0,0,0,0,0,0,0,0,0,0,0,0,0,0,0,0,0,0,0,0,1,Cross-sectional observational study (survey),0,0
56,Viezzer and Biondi 2021,"The influence of urban, socio-economic, and eco-environmental aspects on COVID-19 cases, deaths and mortality: A multi-city case in the Atlantic Forest, Brazil",2021,Sustainable Cities and Society,"To explore COVID-19 influence of urban, socio-economic, and eco-environmental aspects on people’s health in Brazil .",Brazil,Brazilian Atlantic Forest,Original Research,Ecological study,General population,It is not clear,Socioeconomic/Geographic,"1. Bivariate non-parametric correlation between every COVID-19 parameter and urban, socio-economic, and ecoenvironmental indexes, with the application of Spearman’s and Kendall’s.correlation coefficients.2. Multivariate analysis (PCA) for both sets of data (total and >100,000 inhabitants) and for each group of parameters composed by independent variables (urban, socio-economic, and eco-environmental)",-City urbanization.-Socio-economic conditions: population / demographic density/ absolute built area / built area / average per capita income / number of people vulnerable to poverty / illiteracy rate of the population aged 18 / human development.-Eco-environmental: absolute vegetation cover / vegetation over relative to municipality area /absolute forest cover / forest cover relative to municipality,-Place of residence.-Socioeconomic status,"1. Correlation between cases and the C1 urban index was also the strongest (rs = 0.564; t = 0.401), followed by the C2 urban index, that represents demographic density and relative built area, mainly related to COVID 19 reported deaths (rs = 0.493; t = 0.339).2. Mortality rate for municipalities > 100,000 inhabitants (rs = -0.301; t = -0.207), possibly indicating a smaller mortality rate in big cities with better socio-economic conditions..3. Correlation was found between health parameters and the socio-economic index, that represent positive socio-economic conditions..4. Socio-economic index was also correlated with cases (all municipalities rs = 0.268; t = 0.185; municipalities > 100,000 inhabitants rs = 0.261; t = 0.181),.5. No strong correlations between health parameters and the eco-environmental indexes were found considering all municipalities, but there may be some association, nonetheless.",It is not mentioned in this article,"1. Urbanization is the strongest COVID-19 predictor among the parameters considered in this study..2. Urbanized cities, with a higher population, demographic density, and absolute and relative built areas, have higher COVID-19 confirmed cases and deaths..3. Some connection between worse socio-economic variables (higher poverty and illiteracy rates, and lower income and human development index) with higher COVID-19 total and relative cases..4. Eco-environmental aspects were more meaningful when considering the big cities data set (> 100,000), rather than all municipalities with COVID-19 confirmed cases..5. Less absolute vegetation and forest covers were to some degree related to higher deaths per 100,000 inhabitants and mortality.",It does not specify,English,0,1,0,0,0,0,0,0,0,0,0,1,1,0,0,0,0,0,0,0,0,0,0,0,1,1,0,0,0,0,0,0,0,0,0,0,0,0,1,0,0,0,0,0,0,0,0,0,0,0,1,0,0,0,0,0,0,0,0,1,0,1,0,0,0,1,0,0,0,0,0,0,0,0,0,0,0,0,0,0,0,0,0,0,0,0,0,0,1,0,0,0,0,0,1,0,0,0,0,0,0,1,0,0,0,0,0,0,0,0,0,0,0,0,0,0,0,0,0,0,0,0,0,0,0,0,0,0,0,0,0,0,3,Ecological study,0,0
57,Tavares and Betti 2021,"The pandemic of poverty, vulnerability, and COVID-19: Evidence from a fuzzy multidimensional analysis of deprivations in Brazil",2021,World Development,To measure multidimensional poverty within the context of the coronavirus pandemic (States in Brazil),Brazil,-,Original Research,Ecological study,General population,NA,Race/Geographic,Alkire-Foster (AF) method and a fuzzy-set multidimensional analysis. Spearman and Kendall rank correlation coefficients.,"-Unidimentional poverty (monetary poverty).-Vulnerability indicators (sanitation, home shelter, physical distance, and recovery from illness).-Health access.-Multidimensional poverty.-Health Recovery Index and Monetary Poverty",-Socieconomic status.-Place of residence.-Race/ethnicity/culture/language,"1. The northern and northeastern regions have the highest proportion of vulnerability and severe risk of infection with COVID-19. .2. Amazonas state (AM) has the most deaths per million people and among the highest risk: the incidence of vulnerable people according to the health recovery index.is 50.5%. .3. In São Paulo (SP), the state with the most infections in absolute terms, it is 3.9%. More infection in the richest regions, which are less vulnerable..4. Initially, all the measures show a negative relation between the vulnerability indicators and deaths per million people. Beginning in week 14, the correlations increase, meaning that states with the highest vulnerability and severe risk scores have increasing numbers of deaths per million people..5. The health recovery index has greater correlations than the prevention index. The highest Spearman coefficients in the prevention index are 0.41 and 0.44 (for headcount ratio.(HCR) vulnerability and fuzzy severe risk), whereas for the health recovery index they are 0.46 and 0.53 (for fuzzy severe risk and fuzzy vulnerability)..6. Risk of infection of COVID-19 is not favorable for the Indigenous population, which has the worst conditions in all indicators. Brown and Black groups also are at a disadvantage to the White and Asian groups and the total population.","Recommendations for prevention as well as they can, and to guarantee universal coverage by public health services.",1. Big part of the population cannot fully implement the recommended preventive measures and because the social conditions and the health-care system do not meet the basic requirements for avoiding preventable deaths..2. Inequality among regions and ethnic groups..3. Most states with the highest vulnerability and severe risk outcomes also have the largest increase in death rates..4. Money is very important in battling the threat of the pandemic,It does not specify,English,0,1,0,0,0,0,0,0,0,0,0,1,0,1,1,1,1,0,0,0,0,0,0,0,0,1,0,0,0,0,0,0,0,0,0,0,0,0,0,0,0,0,0,0,0,0,0,0,1,0,0,0,0,0,0,0,0,0,0,1,0,0,0,0,0,1,1,0,0,0,0,0,0,0,0,1,0,0,0,0,0,0,0,0,0,0,0,0,0,0,0,0,0,0,1,0,0,0,0,0,0,0,0,0,0,0,0,0,0,0,0,1,0,0,0,0,0,0,0,0,0,0,0,0,0,0,0,0,0,0,0,0,3,Ecological study,0,1
58,I. Pereira and Patel 2021,Impact of the COVID-19 pandemic on the hours lost by self-employed racial minorities: evidence from Brazil,2021,Small Business Economics,To explore if during the COVID-19 pandemic self-employed racial minorities in Brazil lost more hours of work relative to employed racial minorities,Brazil,-,Original Research,Cross-sectional observational study (survey),General population,"n=39,582",Labour,Descriptive analysis,-Race: black/ white.-Employment: public / provate / self employement.-Income: deciles of the reported income / the value of remuneration in the form of goods or products.-Education: complete elementary but not high school/High School/ some college/College/Graduate school..,-Socioeconomic status.-Education.-Race/ethnicity/culture/language.-Occupation,"1. Decline in hours worked is approximately 5.73 h on average.2. The self-employed were more likely to lose hours (r=0.18, p<0.05)with mixed race individuals facing a small increase in hours lost (r=0.01, p<0.05). Self-employment seems negatively correlated with black, yellow, and mixed race. Both age (r=0.03, p<0.05) and female (r=0.02, p<0.05) are associated with increased hours lost..3. Those reporting race as yellow or indigenous, due to small prevalence rates, had substantially overlapping confdence intervals between the employed and the self-employed.","“one-size-fts-all” policy approaches may not work in improving the conditions of the self-employed from racial minority groups..Impact on social, flial, and health costs from the deteriorating economic conditions of the self-employed from racial minority groups must be of special concern to policymakers..Needing for greater responsiveness from policymakers in devising policies that are more conducive to this group’s long-term wellbeing.","1. Self-employed racial minorities in developing countries with limited health and physical infrastructure, less stable macroeconomic conditions, and weaker or non-existent safety nets face distinc tive challenges from the COVID-19 pandemic..2. Careful consideration must be given to the self-employed from racial minority groups in developing countries..3. Self-employed sustaining lower and more volatile income than the employed, business closures and reduction in hours could spell permanent decline in the economic standing of the self-employed. .4. Precarity may have been exacerbated for such groups during the COVID-19 pandemic.5. Small businesses may not fully recover from the economic malaise of the COVID-19 pandemic..6. Deterioration in economic status resulting from COVID-19 may not only further increase income inequality between racial majority and minority groups, but it may also have adverse long-term economic and social consequences for the Brazilian economy.",It does not specify,English,0,1,0,0,0,0,0,0,0,0,0,0,1,1,1,1,1,1,0,1,0,0,0,0,1,0,1,0,0,0,0,0,0,0,0,0,0,0,0,0,0,0,0,0,0,0,0,0,0,0,1,0,1,0,0,0,0,0,0,0,0,0,0,0,1,0,0,0,0,0,0,0,0,0,0,0,0,0,0,0,0,0,0,0,0,0,0,1,0,0,0,0,0,0,0,0,0,0,0,0,0,0,0,0,0,0,0,0,0,0,0,0,0,0,0,0,0,0,0,0,0,0,0,0,0,0,0,0,0,0,0,0,1,Cross-sectional observational study (survey),0,1
