133,Lopes 2021,Ausência de raça e gênero no enfrentamento da pandemia no Brasil,2021,"Revista Eletrônica de Comunicação, Informação & Inovação em Saúde",NA,Brazil,-,Short reports/Letters/commentaries,Narrative reflection,General population,NA,Race/Gender,It does not directly measure inequalities (narrative synthesis),NA,-Race/ethnicity/culture/language.-Gender/sex,"1. Blacks (blacks and browns) account for 56.4% of the Brazilian population, and black women constitute the most vulnerable group. They account for 28% of this population, but they are over-represented in poverty, corresponding to 32.8%, and 9.1% of Brazilians live in extreme poverty.2. At the onset of the pandemic, data on cases of virus infection and disease deaths were released without color/race specification..3. The federal government's failure to provide guidance to federation entities has resulted in little collection and insufficient processing of statistics on race/color and gender, as shown by the survey, carried out in April 2021, in epidemiological bulletins published in all 26 states of the federation and in the Federal District..4. Most states (17) do not disclose information on ethnic-racial membership in the daily epidemiological bulletins. .5. If these data are disaggregated by region, we have the South as the most silent in this regard, since none of its three states bring statistics. On the opposite side appears the North Region, where four of the six states present race in the data communication. In the Northeast, only three of the nine states do so; in the Southeast, two states..6. In June 2020, it can be seen that the number of states that started to incorporate race in the collection and dissemination of data on Covid-19 has doubled. From five in 2020, it became 10 states in the following year..7. When looking at the collection of data disaggregated by gender and ethnic-racial membership, we have 15% of the states that disclose this information, that is, only four of the 27 units of the federation. They are: Amazonas, Acre, Roraima and Espírito Santo. As well as in the production of statistics on color/race, the North Region also appears in data collection by sex as the most representative, as three out of six states in the region specify them..8. It is important to highlight how blacks and black women figured as the first people to be immunized in most states. In three states (São Paulo, Minas Gerais and Espírito Santos), the strategy adopted places the governors, white men, alongside black women.",It is not mentioned in this article,"1. This process as a game, in which white and male institutions have the power to appropriate race and gender with the intention of showing themselves to be diverse, less racist and sexist, valuing black women..2. Racial and gender identities are used to acquire political and social visibility without, however, leading to measures to confront racism and promote equality in this time of health crisis..3. Although states and municipalities have autonomy in managing the pandemic, the federal government has a central role in managing the measures and in guiding federated entities – which fails, above all, in dealing with the racial and gender issue.",None,Portuguese,0,1,0,0,0,0,0,0,0,0,0,0,0,1,1,1,1,0,1,0,0,0,0,0,0,0,0,0,0,0,0,0,0,0,0,0,0,0,0,0,0,0,0,0,0,0,0,0,0,0,0,0,0,0,0,0,0,0,0,0,0,0,0,1,0,0,1,0,0,0,0,0,0,0,0,0,0,0,0,0,0,0,0,0,0,0,0,0,0,1,0,0,0,0,0,0,0,0,0,0,0,0,0,0,0,0,0,0,0,0,0,0,0,0,0,0,0,0,0,0,0,0,0,0,0,0,0,0,0,0,0,0,0,Narrative reflection,0,1
134,T. D. Silva and Silva 2021,"Trabalho, população negra e pandemia: notas sobre os primeiros resultados da PNAD Covid-19",2021,Revista Planejamento e Políticas Públicas,To present a brief description of the conditions of the Brazilian labor market before the effects of the pandemic; during the pandemic and their differences in racial terms,Brazil,-,Review article,Review,Black workers,NA,Race/Labour,It does not directly measure inequalities (narrative synthesis),NA,-Occupation.-Race/ethnicity/culture/language,"1. By the end of May 2020, the total employed population had already decreased by around 7 million people, compared to the same period of the previous year, and, in the accumulated result for the year up to this period, there was already a negative balance of more 1.1 million formal jobs..2. The estimated unemployment rate rose from 11.8% to 12.8% between February and May 2020, and was only not higher due to the substantial drop in the labor force participation rate (from 62% to 56%) in the same period, mainly due to the portion of the population without a job that stopped seeking relocation due to the necessary measures of sanitary prevention..3. Estimates point to an absolute fall in employment of around 9.9 million between February and May 2020, in addition to an increase in the depressed population (+1.2 million) and a drop in those employed with social security contributions (-3.3 millions). As a result, the mass of income effectively received decreased by R$37 billion, down 16.5%..4. The first data from PNAD Covid-19 already indicated that 5.2% of Brazilian households (about 3.5 million) survived in the month of May only with the income received from emergency aid from the federal government, moving the following month to 6.5%, 4.5 million households.5. Practically all economic sectors registered a decline in employment compared to the same period of the previous year, with the most affected being: commerce, civil construction, food and accommodation, in addition to the category of domestic services, strongly marked by informal ties ..6. The only sectors that did not suffer a retraction were: agriculture, services for companies (information, communication and financial, real estate, professional and administrative activities) and public administration.7. According to data from PNAD Covid-19, people who declared themselves black and brown corresponded, in June 2020, to 54.9% of the workforce,3 being 52.5% of the employed4 and 60.3% of the unemployed this month of reference. During the first months of the pandemic in the country, the unemployment rate grew for all groups of color or race, with a general average going from 10.7% to 13.1% between May and July. Considering only the black population – men and women – this increase was even higher: it went from 10.7% and 13.8% to, respectively, 12.7% and 17.6% (Table 1)..8. The effects of these measures on economic activity led several companies to reduce their productive activities, or even close them, reducing the demand for work or even taking advantage of government initiatives to temporarily suspend employment contracts..9. the black population, which corresponded to 52.3% of the employed, represented 58.4% of those temporarily on leave in May. This overrepresentation is also verified in the following months. The distancing was more intense for the group of black women. Despite corresponding to 21.5% of the total employed, they represented 30.9% of people temporarily away from work. As shown in table 2, although the percentage of absences decreased in the following months, the group of black women, in particular, remained as the most affected by absence from work..10. Occupations with weaker ties were the most affected by social distancing. While employees without a formal contract in the private sector and self-employed accounted for 9.6% and 29.0% of those employed, they were, respectively, 11.8% and 35.0% of those on leave due to social distance..11. Black women workers were the ones who had the greatest reduction in working hours, with consequent repercussions on earnings, the data also show that, even among professionals with higher education, black women were the only ones who spent less than a workload. 70% of usual. (Graphic 1).12. More than 8.7 million workers continued to work remotely, corresponding to 10.3% of those employed in May, with a reduction in this rate in the following months. Remote work was the reality for 17.6% of employed (not on leave) whites and for only 9% of blacks in this situation (Table 3). Only about a third of the total number of workers employed in remote activities were black workers..13. As shown in table 4, in July, 36.9% of the population over 14 years old out of the labor force (inactive), about 28 million people, was in a situation of discouragement. Of this set, about two thirds (65.3%) corresponded to black individuals. It is noteworthy that 67.0% of the total discouraged attribute this condition to the pandemic, which we call in this text discouraged by the pandemic.",It is not mentioned in this article,"1. The multiple and intersectional inequalities that weigh on the black population have been intense and aggravated during this time of pandemic..2. In addition to paying attention to the direct effects of health conditions and access to medical care, the prospects for subsistence and labor insertion are essential to, at least, not allow for the expansion of racial inequalities, which are so striking and structuring in the country..3. They formed the vast majority of the labor capacity subject to the situation of hidden unemployment due to despondency, largely justified by the impossibility of seeking employment during the pandemic..4. In the absence (or insufficiency) of social safety nets, the horizon becomes more than worrisome..5. In addition to policies to guarantee employment and encourage productive activity, especially in labor-intensive sectors, the expansion and strengthening of social and labor protection networks are fundamental measures in order to prevent the current effects of the crisis lead to the intensification of the already expressive level of racial inequality existing in the labor market",It does not specify,Portuguese,0,1,0,0,0,0,0,0,0,0,0,0,0,1,1,1,1,0,0,1,0,0,0,0,0,0,0,0,0,0,0,0,0,0,0,0,0,0,0,0,0,0,0,0,0,0,0,0,0,0,0,0,0,0,0,0,0,0,0,0,0,0,0,0,1,0,1,0,0,0,0,0,0,0,0,0,0,0,0,0,0,0,0,0,0,0,0,0,0,1,0,0,0,0,0,0,0,0,0,0,0,0,0,0,0,0,0,0,0,0,0,0,0,0,0,0,0,0,0,0,0,0,0,0,0,0,0,0,0,0,0,0,0,Review,0,1
135,Cotrim Junior and Cabral 2020,Crescimento dos leitos de UTI no país durante a pandemia de Covid-19: desigualdades entre o público x privado e iniquidades regionais,2020,Revista Ciência & Saúde Coletiva da Associação Brasileira de Saúde Coletiva,To investigate the expansion of ICU beds in different regions of Brazil,Brazil,-,Review article,Review,General population,NA,Scocioeconomic,It does not directly measure inequalities (narrative synthesis),NA,-Socioeconomic Status,"1. The Southeast Region concentrates (51.9%) of the national ICU beds, while the North (5.2%) and Central-West (8.5%) regions do not reach 10% of the total beds..2. There was a jump in the number of beds in the country, from 46,045 in December 2019 (pre-pandemic moment) to 60,265 (post-pandemic) in April 2020. In other words, in approximately four months, there was an increase in 14,220 beds, which represents a total increase of 23.59%, and which is quite significant..3. 3,104 are from the Health Unic System, that is, available to the entire population, including those with a private health plan. This timid advance of the Health Unic System represents only 21.82% of new ICU beds..4. With its growth, the private sector managed to install over 11,116 beds, which represented 78.18% of new intensive care beds across the country, expressing unprecedented inequality in the recent history of the country, that is, since the implementation of the Health Unic System ..5. With the pandemic, the numbers were very inverted and the country had an offer of 26,153 public beds compared to 34,112 private ICU beds, resulting in a difference of 7,959, very different from the old 53 beds, the largest in the public sector..6. A country in which only 22.41% of the population has a private plan, representing a total of 47,084,565 people, and the other 77.59% (or 163,062,560 people) depend exclusively on the SUS..7. In the North Region (8.77% of the national population), 90.72% are exclusively dependent on the Health Unic System, and they dispute 1,793 SUS ICU beds, which means that there is approximately one SUS bed for every 9,325 people. Also in this region, it can be seen that 9.28% of the population have health insurance and dispute 1,335 beds, resulting in an approximate proportion of one bed for every 1,281 people..8. In the Northeast Region, (27.15% of the country's population). Of these, 88.43% depend solely on the SUS, competing for 5,968 beds, making up the approximate proportion of one bed for every 8,456 people. As for the beneficiaries of health plans, it is noted that they are 11.57% of the population in this region competing for 6,512 ICU beds, which results in approximately the proportion of one bed for every 1,013 people.",It is not mentioned in this article,"1. Public regulation of beds (single-line) seems to be a measure of justice that urgently needs to be implemented, unless it is validated, once again, that some lives are more important than others.2. Regional differences in bed supply, rather than being an argument against bed unification, is actually an argument in favor.3. 77.59% of the Brazilian population depends exclusively on the SUS, but they only have 26,153 beds spread across the country, while the situation of beneficiaries of health plans is absurdly more comfortable (in relation to the supply of ICU beds, it is clear).4. Despite a little more than three quarters of the population being dependent on Health Unic System, the great expansion of intensive beds occurred in the private sector, making up, until April 2020, 78.18% of the national growth, while the increase of SUS beds resulted in a timid 21.82% of the total growth..5. This, in turn, contrasts with the desires and speeches of sanitarists, that the Health Unic System is getting stronger in the pandemic, which certainly occurs within the scope of society's perception, but from the concrete point of view, of improvements in the system, as the expansion of the ICUs, an exponential growth of the supplementary sector can be seen.",It does not specify,Portuguese,0,1,0,0,0,0,0,0,0,0,0,0,0,0,0,0,0,0,0,0,0,0,0,0,0,0,0,0,0,0,0,0,0,0,0,0,0,0,0,0,0,0,0,0,0,0,0,0,0,0,0,0,0,0,0,0,0,0,0,0,0,0,0,0,0,0,0,0,0,0,0,0,0,0,0,0,0,0,0,0,0,0,0,0,0,0,0,0,0,1,0,0,0,0,0,0,0,0,0,0,0,0,0,0,0,0,0,0,0,0,0,0,0,0,0,0,0,0,0,0,0,0,0,0,0,0,0,0,0,0,0,0,0,Review,0,0
136,Ferraz et al. 2021,COVID Health Structure Index: The Vulnerability of Brazilian Microregions,2021,Social Indicators Research,To create a COVID Index to verify whether the hospital structures in 543 Brazilian microregions are adequate to deal with COVID-19 and to verify whether public policies were implemented in the right direction.,Brazil,-,Original Research,Ecological study,General population,"These databases capture information from 2,748 municipalities and represent 86.92% of all inhabitants of Brazil in 2020. The municipalities are divided into 543 microregions (Data from seven variables of the official databases from April 16 to May 8, 2020)",Socioeconomic/Geographic/Health,Mathematical method based on linear programming: analyzing the coronavirus pandemic in Brazil using a two-stage model.,"Hospital structure - Five variables: Healthcare equipment (respirators, intensive care units (ICUs) and hospital beds) and human capital (physicians and nurses).",-Socioeconomic status.-Place of residence,"1. Analyzing the 543 microregions in Brazil, these findings reveal that, in April, 20 microregions (3.68%) presented the worst COVID Index (1.0)..2. Southeast region and Sao Paulo state were considered the epicenter of the pandemic, 60% of the regions classified as experiencing an inadequate situation were concentrated in Brazil’s North or Northeast because of the inadequate hospital infrastructure of these poor regions, where the health system struggles with a lack of resources and professionals..3. 26 microregions (4.78%) presented the worst performance in terms of the COVID Index. These microregions were concentrated in the North (46.15%) and Northeast (39.62%). 60% of the regions with the 20 best COVID Index performance scores (0.0 to 0.25) were concentrated in the South, Southeast and Midwest of Brazil.","1. The Federal Government’s actions were limited to distributing financial resources, respirators and other materials to hospitals in several regions, especially in urban centers..2. Federal Program to Combat Coronavirus (Programa Federativo de Enfrentamento ao Coronavírus) created by the Federal Government allocated the fixed amount of 60 billion Reais (R$) [U$11,353 billion] from the Federal Government to states and municipalities.3. According to the law, authorities can spend R$ 50 billion [U$ 9,461 billion] on several economic purposes. Authorities are obligated to spend R$ 10 billion [U$ 1,892 billion] on health assistance. However, only R$ 2.8 billion [U$ 529 million] were destinated taking into account the number of people infected by coronavirus.","1. These findings reveal the inequality of hospital infrastructure across the Brazilian microregions, which follows the patterns of economic and social discrepancies in Brazil..2. The COVID Index reveals that microregions in the North and Northeast of Brazil need more attention from policymakers.3. The metafrontier shows that the Brazilian situation became worse from April to May 2020.4. Through the COVID Index, policymakers have straightforward information to decide which regions must receive new investments, hire health professionals, and reallocate resources",None: Open Access funding enabled and organized by Projekt DEAL. There is no funding,English,0,1,0,0,0,0,0,0,0,0,0,1,1,0,0,0,0,0,0,0,0,0,0,0,0,0,0,0,0,0,0,0,0,0,0,0,0,0,0,0,0,0,0,0,0,0,0,0,0,0,0,0,0,0,0,0,0,0,0,0,0,1,1,0,0,1,0,0,0,0,0,0,0,0,0,0,0,0,1,0,0,0,0,0,0,0,0,0,0,0,0,0,0,0,0,0,0,0,0,0,0,0,0,0,0,0,0,0,0,0,0,0,0,0,0,0,0,0,0,0,0,0,0,0,0,0,0,0,0,0,0,0,1,Ecological study,1,0
137,Mancini 2021,Confinement risks and social inequality in Latin America: Evidence from Argentina,2021,Current Sociology,"To investigate, from the sociological approach of risk-taking, the relationship between confinement, secondary risks and social inequality.",Argentina,-,Review article,Commentary,General population,NA,Socioeconomic/Sctructural,It does not directly measure inequalities (narrative synthesis),NA,-Socioeconomic status.-Social capital,"1. The first group contains people of low social origins or belonging to the working class (Their jobs do not allow them to work from home; this is the group that performs the most essential services). The second group comprises the typical Argentinian middle class. The third group is made up mainly of the upper-middle class..2. Everybody is confined (to the extent that it is mandatory), but not everybody is confined under the same conditions..3. Seven large groups of secondary and experiential risks produced by the confinement have been identified in the analysis: .a. The first group is comprised of subjective or emotional risks. The second group comprises what I have identified as temporal risks (social jet lag), namely, sensations and perceptions linked to the loss of social orientation of time during the lockdown. The third group is that of material risks, that is, the material or socioeconomic effects of the lockdown.The fourth group is comprised of health risks, those directly linked to the physical health of confined people, as well as the subjective probabilities of getting infected or being hospitalised. The fifth group is formed by the so-called voluntary risks (They are perceptions that relate confinement to willingness).The sixth group is about moral and normative risks, related to the collective duty of.complying with the confinement. the seventh group is comprised of symbolic and political risks.4. Subjective/emotional and health risks are mainly associated with women, salaried employees who are able to work from home during confinement (but without separate rooms to do so) and middle-class individuals who live in apartments and are between 30 and 49 years old..5. The symbolic/political, temporal and material risks are mainly associated with people between 50 and 69 years old, who have private health insurance, belong to the upper-middle or upper class, are part of nuclear families and are mainly men..6. Voluntary and moral/normative risks are associated with the working and lower classes, between 18 and 29 years old, who do not have access to social security, work in essential jobs and live in extended households..7. The middle and upper classes have increased their cultural consumption during the lockdown (movies, plays, and even operas using digital platforms).While , the cultural consumption of the lower classes has declined..8. Those of a higher social class increased their participation in workshops and online courses (cooking, arts, yoga); the lower classes decreased their participation..9. The ‘family climate’ varies according to socioeconomic status: whereas the upper classes were found to have a very good climate during the quarantine, among the lower classes (where unemployment and overcrowding are higher), family climate was more conflictive..10. Most distinctively upper-class behaviours are associated with men. Women, by contrast, shop less and take fewer courses.11. Women are more afraid of contagion (particularly their own contagion or that of their families) and fear the collapse of the health system.  12. People from the middle and working classes, who receive a regular salary, are less than 70 years old, with middle incomes and social security. This group identifies itself with a centre-left or left-wing ideology; strongly approves the mandatory measures adopted by the government and its performance with regard to the pandemic (it should be remembered that the Argentinian government is left-leaning)..13. Among the upper classes, where a right-wing or centre-right ideology predominates, the evaluation of governmental performance is highly critical..14. The social group comprised of unemployed or inactive individuals who belong to the lower classes and do not have social security. This group stays away from political ideology, from evaluating the government or measures of social control..","On 19 March 2020, the Argentinian government declared ‘mandatory preventive social isolation’, which prohibited free movement of people throughout the national territory; only minimum and indispensable trips to get medicine and food were allowed. Essential workers or those who needed to go out for emergency reasons (such as visiting the doctor or assisting older adults) were required to have a special permit; otherwise, severe economic fines would be applied.","1. This main finding is that inequality and social class differences mediate the relationship between secondary risks and confinement. Subjective and emotional risks are the most prevalent across different social strata..2. It also found a relationship between political ideology, perceptions about government performance and attitudes towards communitarian social control.","None: The author received no financial support for the research, authorship, and/or publication of this article",English,1,0,0,0,0,0,0,0,0,0,0,0,1,0,0,0,0,0,0,0,0,1,0,0,0,0,0,0,0,0,0,0,0,0,0,0,0,0,0,0,0,0,0,0,0,0,0,0,0,0,0,0,0,0,0,0,0,0,0,0,0,1,0,0,0,0,0,0,0,0,0,0,0,0,0,0,0,0,0,0,0,0,0,0,0,0,0,0,0,1,0,0,0,0,0,0,0,0,0,0,0,0,0,0,0,0,0,0,0,0,0,0,0,0,0,0,0,0,0,0,0,0,0,0,0,0,0,0,0,0,0,0,0,Commentary,0,0
