97,Denny et al. 2021,COVID-19 magnifies the vulnerabilities: The Brazilian case,2021,International Journal of Discrimination and the Law,"To discuss inequalities of the health system in Brazil and advocates that now, more than ever in light of the Covid-19 pandemic, the world needs to put in place a more collaborative and egalitarian way of financing health research and investments in public health systems.",Brazil,-,Essays/Reflection article,Narrative reflection,General population,NA,Health/Socioeconomic,It does not directly measure inequalities (narrative synthesis),NA,-Place of residence.-Socioecomic status,"1. The challenge of coping with a global pandemic brings the opportunity to comprehensively address the serious human vulnerabilities it has revealed; and presents a rare opportunity for instituting bold structural reforms that can revive and sustain prosperity in the post-Covid-19 world..2. An effective global initiative is needed and it could focus on several important functions. First it could strengthen multisectoral approaches such as the COVAX global collaboration in order to accelerate the development, production, and equitable access to COVID-19 tests, treatments, and vaccines. .3. An effective global initiative could support the creation and funding of a Global Intellectual Property Repository, to accelerate the assemble and deployment of existing and newly established intellectual property in relevant pharmaceutical molecules, diagnostics, health data, software, 3D printing codes etc..4. The initiative could foster the creation and funding of a Global Logistics Centre to help monitor and coordinate the worldwide demand and supply of urgently needed goods and services, such as medicines, diagnostics, medical supplies and machinery, personal protective equipment, trained medical personnel and transport capacities..5. The creation and funding of a Global Pre-emption Taskforce that would identify and protect populations that lack resources or pose particular risks to others.",It not mentioned in this article,"1. The inequitable response to the pandemic so far only reinstates that healthy life expectancy and mortality rates are markedly disproportionate between the richest and poorest populations..2. Disinformation and miscommunication disproportionally affect individuals with less access to information channels, who are thus more likely to ignore scientific recommendations such as physical distancing measures..3. Brazilians are particularly prone to believe on the information they receive through any communication media. Unfortunately fake news spreads 70% faster than real news even in traditional media. .4. The most effective reforms will come about through concerted intergovernmental cooperation, not isolationist measures: a view of the state as responsive and aware of its responsibilities accordingly to the theory of vulnerability..5. Made possible rapid availability of the vaccine worldwide, in an equitable and efficient manner, not prioritizing only the rich countries that can afford the price and the technology (freezers, energy etc) needed to complete the distribution..6. The repository would have to receive donations from national governments as well as public, and private sectors, relating to health to the amount it should be prepared to pay competitive prices so as to encourage a stream of useful innovations continuously. .7. The goal is to overcome poor information, bureaucratic execution and deliveries disruptions due to higher bidders..8. Collaboration with national health systems, international agencies and NGOs would foster a strong public-health strategy around the innovator product and enable the research focus on the diseases more common among the poor..9. The global architecture for taxation and the illicit flows of money hinders this funding. The injustice that misplaced taxes plays results in systemic damage to human rights, especially women’s rights and across a whole range of intersectional inequalities. .10. The global disruption must be taken as an opportunity to implement major structural reforms such as the ones this paper outlines, on the expectation to inspire public policies capable of shaping a fairer new normality.",None,English,0,1,0,0,0,0,0,0,0,0,0,1,0,0,0,0,0,0,0,0,0,0,0,0,0,0,0,0,0,0,0,0,0,0,0,0,0,0,0,0,0,0,0,0,0,0,0,0,0,0,0,0,0,0,0,0,0,0,0,0,0,1,1,0,0,0,0,0,0,0,0,0,0,0,0,0,0,0,0,0,0,0,0,0,0,0,0,0,0,1,0,0,0,0,0,0,0,0,0,0,0,0,0,0,0,0,0,0,0,0,0,0,0,0,0,0,0,0,0,0,0,0,0,0,0,0,0,0,0,0,0,0,0,Narrative reflection,0,0
98,Mesquita and Bezerra 2021,“Brazil cannot stop”: Meritocratic ideology in an unequal country,2021,"Gender, Work & Organization",To reflect on the measures adopted by the Brazilian government in the scope of education amid the COVID-19 pandemic.,Brazil,-,Essays/Reflection article,Narrative reflection,General population,NA,Education/Ethnicity,It does not directly measure inequalities (narrative synthesis),NA,-Education.-Race/ethnicity/culture/language,"1. Many low-income families who registered to receive emergency aid from the government had not yet received even the first installment, jeopardizing their health by having to stand in long lines and agglomerations at government bank agencies, as many did not have access to a smartphone to request help through the digital application provided by the government..2. With the COVID-19 pandemic, this scenario worsens, as many Black youngsters have no adequate material conditions or psychological conditions, as due to their socioeconomic vulnerability, Black persons are the most affected victims of the new coronavirus as well as its consequences, such as unemployment..3. The measures adopted by the government in the scope of education in view of the COVID-19 pandemic reflec society's structural racism and MEC's institutional racism.",It not mentioned in this article,"1. Actions and initiatives reflect the Brazilian society's structural racism and MEC's institutional racism, which naturalizes meritocratic discourses in a country with profound social and racial inequality..2. It is necessary to improve the quality of public basic education, to increase the competitiveness of high school graduates; continuously improve teacher training and the infrastructure of the entire education system; ensure good conditions for students to remain in basic and higher education.",CAPES,English,0,1,0,0,0,0,0,0,0,0,0,0,0,1,1,1,1,1,0,0,0,0,0,0,0,0,0,0,0,0,0,0,0,0,0,0,0,0,0,0,0,0,0,0,0,0,0,0,0,0,0,0,0,0,0,0,0,0,0,0,1,0,0,0,0,0,0,1,0,0,0,0,0,0,0,0,0,0,0,0,0,0,0,0,0,0,0,0,0,1,0,0,0,0,0,0,0,0,0,0,0,0,0,0,0,0,0,0,0,0,0,0,0,0,0,0,0,0,0,0,0,0,0,0,0,0,0,0,0,0,0,0,0,Narrative reflection,0,1
99,Li et al. 2021,"Higher risk of death from COVID-19 in low-income and non-White populations of São Paulo, Brazil",2021,BMJ Global Health,"To characterise the differential risk of hospitalisation and death in São Paulo state, Brazil, and show how vulnerability to COVID-19 is shaped by socioeconomic inequalities.",Brazil,Sao Paulo,Original Research,Ecological study,Patients diagnosed with COVID-19,"n=178,345",Socioeconomic/Geographic/Race/Education,1. Individual-level analysis to estimate the probability of reporting a SARI hospitalisation given a patient’s race and average income level in their census tract of residence: Probabilities for each age-sex group were estimated empirically using relative frequencies. ORs using White patients and the highest income level as reference groups were computed .2. Ecological spatiotemporal regression analysis was conducted at the municipality level for São Paulo state: The relative risk of hospitalisation was estimated using a hierarchical Bayesian model composed of a generalised log-linear model with spatially structured and unstructured random effects to account for spatial autocorrelation and time-varying random effect.,"-Race: White/ Black/ Asian/ (East or Southeast Asian)/ Pardo (mixed ethnic ancestries with diverse skin colours) / Indigenous. .-Household income per capita.-Income inequality (Gini Index). .-Proportion of residents with a primary education or lower.-Employment to population ratio and the proportion of the working population without a formal labour market contract or social security..-Administrative type of the health facility where the patient was hospitalised (public or private). .-Age.-Gender: Male/Female.-Comorbidities: Chronic obstructive pulmonary disease/ diabetes/ hypertension or cardiovascular disease such as myocardial infarction, angina or heart failure","-Socioeconomic status.-Education.-Race/ethnicity/culture/language.-Occupation.-Gender/sex.-Personal characteristics associated with discrimination (e.g. age, disability)","1. During this time, 232?540 patients were notified, from these 223?455 were hospitalised (98.4%) or died without hospitalisation (1.6%). From the non-hospitalised cases, we only selected deaths; 54?108 patients died, of which 52.5% were White, 20.2% were Pardo, 6.13% were Black, 1.96% were Asian, 0.052% were Indigenous and 19.6% did not have race information.2. During March in Brazil, hospitalised patients were more likely to be White or Asian and come from census tracts with higher income per capita. During this period, people living in low-income areas were less likely (OR: 0.44, 95% CI 0.42 to 0.46) to be hospitalised with SARI compared with high-income areas..3. In August, patients were less likely to be from low-income census tracts (OR: 0.95, 95% CI 0.91 to 1.00). Similarly during this time period, Black Brazilians and Pardos became more likely to be hospitalised with SARI than Whites (OR: 1.41, 95% CI 1.37 to 1.46; OR: 1.26, 95% CI 1.23 to 1.28, respectively), while Asians became the least likely to be hospitalised (OR: 0.88, 95% CI 0.82 to 0.94)..4. Once hospitalised, Black and Pardo patients were more likely to die from SARI than White patients between March and August (OR: 1.14, 95% CI 1.07 to 1.21; 1.09, 95% CI 1.05 to 1.13, respectively)..5. Patients treated in public hospitals were more likely to die than patients treated in private hospitals throughout the epidemic (OR: 1.40%, 95% CI 1.34% to 1.46%)..6. They found a lower risk of SARI by SARS-CoV-2 hospitalisation in municipalities with high income per capita (fixed effect=-0.87, 95% CI -1.12 to -0.62) and high proportion of adult residents with a primary education or lower (-0.90, 95% CI -1.12 to -0.68)..7. Municipalities with fewer nearby public health facilities were also found to have lower risk of hospitalisation (-0.31, 95% CI -0.55 to -0.08). We also found a higher risk of SARI hospitalisation in municipalities with higher population density (0.31, 95% credible interval: 0.07–0.54).8. 14 days after the introduction of NPIs, isolation levels were 8.2% (95% CI 7.2% to 9.2%) higher in predominantly White areas compared with predominantly Black areas. Similarly, 27 days after the introduction of state-level NPIs, isolation levels were 11.2% (95% CI 10.6% to 11.9%) higher in the wealthiest than in the poorest areas..9. Nonetheless, because Black and Pardo populations are disproportionally employed in informal and low-skilled jobs, these racial groups were, in general, more likely to be working face to face during our study period..10. Workers with pre-primary education were more likely to work in occupations that require in-person contact than workers with tertiary education (probability (PR): 0.89, 95% CI 0.87 to 0.90 compared with PR: 0.58, 95% CI 0.57 to 0.60) and less likely to work in occupations that allow teleworking (PR: 0.005, 95% CI 0.004 to 0.007 vs PR: 0.36, 95% CI 0.35 to 0.37, respectively).11. Individuals with primary education or lower are more likely to have one or more comorbidities (OR: 1.36, 95% CI 1.27 to 1.45). Similarly, Black individuals were also more likely to have one or more comorbidities than White individuals (OR: 1.29, 95% CI 1.19 to 1.39).",It is not mentioned in this article,"1. This study shows that socially disadvantaged groups are disproportionately more likely to be hospitalised and die from SARI. .2. Differential health outcomes can be explained by structural inequities linked to the incidence of comorbidities and to socioeconomic conditions, which limit the ability of low-income and non-White populations to socially isolate and reduce their access to quality health services..3. It found that hospitalisation risk is higher for populations living in municipalities that travel to and from the Região Metropolitana de São Paulo (RMSP), with low income per capita and high population density compared with the rest of São Paulo state..4. Patients living in the 40% poorest areas were more likely to die when compared with patients living in the 5% wealthiest areas (OR: 1.60, 95% CI 1.48 to 1.74) and were more likely to be hospitalised between April and July 2020 (OR: 1.08, 95% CI 1.04 to 1.12)..",Medica Research Council-São Paulo Research Foundation (FAPESP) CADDE partnership award (MR/S0195/1 and FAPESP 18/14389-0) (http://caddecentre.org/).,English,0,1,0,0,0,0,0,0,0,0,0,0,1,1,1,1,1,1,1,1,0,0,1,0,1,0,0,0,1,1,1,0,0,0,0,1,0,0,0,1,0,0,0,0,0,0,0,1,1,0,1,1,1,0,0,0,0,0,0,0,1,1,0,0,0,1,1,0,0,0,0,0,0,0,0,0,0,0,1,1,1,0,0,1,0,0,0,0,0,0,0,0,0,0,0,0,1,0,0,0,0,0,1,0,0,0,0,0,0,0,0,0,0,0,0,0,0,0,0,1,0,0,0,0,0,0,0,0,0,0,0,0,7,Ecological study,2,1
100,Rivera and Castro 2021,Between social protests and a global pandemic: Working transitions under the economic effects of COVID-19,2021,Social Sciences,To explore the employment trajectories of workers throughout the ongoing pandemic in Chile: a neoliberal country with a strong male breadwinner culture and high levels of income inequality.,Chile,-,Original Research,Retrospective cohort study,General population,"n=8,864",Occupation/Gender,Exploratory (sequence analysis) and predictive (multinomial logistic regression) methods,"-Unemployment rate .-Market indexes for mobile quarters: labor informality/working hours/ employment relationships.-Family variables: relationship status (lives with a partner -either married or cohabiting-, and 0 = otherwise), presence of children 0 to 5 years, presence of children 6 to 13 years, and breadwinner..-Economic sector: primary sector/ manufacture and construction/ commerce / services.",-Occupation.Gender/sex,"1. Although women had a lower percentage of employment, they had more unsteady and diverse trajectories than men. entropy index of women is always higher than of men, i.e., they have more diverse states in each time position than men..2. Higher proportion of men (69%) remained continuously employed throughout the first months of the pandemic than women (55%), and in the cluster the men cluster had a partner (71%) and were the main breadwinner of the household (74%) at a higher rate than their female counterparts.3. A higher percentage of women (18%) were on furlough when compared to men (11%), probably because women are employed to a greater extent in the service sector, one of the economic sectors most affected by the measures to halt the spread of the pandemic.4. A higher percentage of men transitioned to unemployment (20%) than women did (14%). However, an important group of women stopped working and were dedicated to care work (13%). This would not be the case for men,.5. Men and women who remained continuously employed throughout 2020 had good working conditions, i.e.,low self employment, low labor informality, and most of them worked under contracts. .6. They were also the most educated groups, with women having a higher percentage of higher education (53%) than men (36%).","Employment status was introduced by the Law of Employment Protection, which allows employers to either suspend the contract of the employees by “authority act” (that is, when the authority obliges the partial or complete cessation of activities due to, for example, quarantines)","1. Men remained in continuous employment in greater proportion than women. .2. Male workers with family remained employed in a higher proportion than female workers with family. .3. At least half of the women who stopped working after the start of the pandemic did so for care-giving reasons, which would not be the case for men. .4. Women who moved into care work had the worst working conditions..5. Association between poorer working conditions, family responsibilities, and the transition to care work, which leaves unemployed women with young children economically dependent on their partners.",It does not specify,English,0,0,0,1,0,0,0,0,0,0,0,0,0,0,0,0,0,0,1,1,0,0,0,0,0,0,0,0,0,0,0,0,0,0,0,0,0,0,0,0,0,0,0,0,0,0,0,0,1,0,0,0,0,0,0,0,0,0,0,0,0,0,0,1,0,0,0,0,0,0,0,0,0,1,0,0,0,0,0,1,0,0,0,0,0,0,0,0,0,0,0,0,0,0,0,0,0,0,0,0,0,0,0,0,0,0,0,0,0,0,0,0,0,0,0,0,0,0,0,0,0,0,0,0,0,0,0,0,0,0,0,0,1,Retrospective cohort study,1,0
101,"Nogueira, Rocha, and Akerman 2021",Políticas públicas adoptadas en la pandemia de la COVID-19 en tres países de América Latina: contribuciones de la Promoción de la Salud para no volver al mundo que existía,2021,Global Health Promotion,"1) Their low social immunities prior to the pandemic are pointed out.2) Their public policies in response to the pandemic are analyzed, considering the different approaches to health intervention: risk groups, population, vulnerability and universal proportionalism.3) It indicates how Health Promotion (HP) could influence public policies not to return to the world that existed",Argentina/Brazil/Chile,-,Original Research,Documentary analysis (primary and secondary data),General population,NA,Structural/Socioeconomic,It does not directly measure inequalities (narrative synthesis),NA,-Place of residence.-Socioeconomic status.-Social capital,"1. There are signs of disarticulation between the spheres of government, less marked in Argentina and Chile, countries with greater federal centralization, and more marked in Brazil, where there is greater autonomy guaranteed by the Constitution to entities of states and municipalities..2. Degrees of solidarity with the workers and employers in flexibilization of labor legislation and payment of taxes, notably more generous in Argentina than in Brazil or Chile and the absence of concern on the part of governments for the environmental balance..3. Actions are seen aimed at increasing the collective empowerment, most noted in Argentina, where policies seem to create possibilities for mutual support among citizens, favoring greater commitment and prioritizing social investment, while in Brazil and Chile the legislation seems to prioritize individual protection, holding people responsible for their care..4. The pandemic uncovers social inequalities in all three countries. However, there are emergency protective measures for ensure the survival of the most fragile who, however, they do not alter the structure of distribution of resources, services and power..5. Argentine policies make explicit the perspective of life cycle, supporting retirees and pensioners, pregnant women, students and workers in sectors most affected. Chile look with attention to the students. Brazil does not adopt life cycle perspective in your policies.","1. Brazil: The boarding in specific subpopulations with focus on groups risk can be represented by the measures of selective confinement of the elderly and carriers of comorbidities. It's has been widely criticized, since it does not consider social barriers and economic for confinement and does not raise health levels in the most vulnerable groups. .2. Chile: alternating total confinement and by regions, predominantly considering the biological risk and not social vulnerabilities. Socio-spatial inequities and conditions of housing, and use of military troops to night curfew emphasize intervention with low social participation in making decisions..3. Argentina: decreed social confinement mandatory horizontal at the national level (agreed with the different ministries in an intersectoral manner) and with additional resolution of income transfer for pensioners and beneficiaries of social programs. Also, through inter-institutional articulation and intersectoral, adopted measures to confront of situations of gender violence, including fiscal actions of the Public Ministry. Seeks to reverse trends and align health equity policies with policies more spacious.","1. Situations of austerity and pandemic generate decrease in income, pessimism, seclusion, loneliness, violence, illness and death..2. Governments should guarantee systems of protection to increase social immunity and resilience. As an indispensable part of an answer coordinated policy for the crisis, people need have access to health care, safety employment and income and education, particularly among the most vulnerable, but without ignoring the rest of the population..3. As the goal of improving the health of the population may not necessarily be compatible with the aim of reducing disparities, public health strategies should include approaches universal populational, considering the gradients with a view to promoting equity..4. The intersectoral governance through actions coordinated that favor the protection of life notes the harm reduction of the pandemic.5. The need to adopt multiscale approaches considering the articulation of the dimensions micro, medium and macro for the confrontation of the structural causes of health inequities.6. The need to advance in the recognition of the climate crisis and include the environmental dimension in the actions undertaken.",None,Spanish,1,1,0,1,0,0,0,0,0,0,0,1,1,0,0,0,0,0,0,0,0,1,0,0,0,0,0,0,0,0,0,0,0,0,0,0,0,0,0,0,0,0,0,0,0,0,0,0,0,0,0,0,0,0,0,0,0,0,0,0,0,1,0,0,0,0,0,0,0,1,0,0,0,0,0,0,0,0,0,0,0,0,0,0,0,0,0,0,0,1,0,0,0,0,0,0,0,0,0,0,0,0,0,0,0,0,0,0,0,0,0,0,0,0,0,0,0,0,0,0,0,0,0,0,0,0,0,0,0,0,0,0,0,Documentary analysis (primary and secondary data),0,0
